{
  "$schema": "https://json-schema.org/draft/2020-12/schema",
  "$id": "https://shelfbound.dev/schema/snapshot.v0.schema.json",
  "title": "Shelfbound Snapshot",
  "description": "Versioned, portable export of local game-library context. The contract between the Shelfbound scanner, the local MCP server, and hosted ingestion. See docs/project/snapshot-schema.md.",
  "type": "object",
  "additionalProperties": false,
  "required": ["schemaVersion", "snapshotId", "createdAt", "source", "device", "stats"],
  "properties": {
    "schemaVersion": {
      "type": "string",
      "description": "Semantic version of this contract.",
      "pattern": "^\\d+\\.\\d+\\.\\d+$"
    },
    "snapshotId": { "type": "string", "description": "Unique id for this snapshot instance." },
    "createdAt": { "type": "string", "format": "date-time" },
    "source": {
      "type": "object",
      "additionalProperties": false,
      "required": ["tool", "toolVersion", "platform"],
      "properties": {
        "tool": { "type": "string" },
        "toolVersion": { "type": "string" },
        "platform": { "$ref": "#/$defs/osPlatform" }
      }
    },
    "device": {
      "type": "object",
      "additionalProperties": false,
      "required": ["id", "name", "type", "os"],
      "properties": {
        "id": { "type": "string", "description": "Random, locally persisted, non-identifying device id." },
        "name": { "type": "string" },
        "type": { "$ref": "#/$defs/deviceType" },
        "os": { "$ref": "#/$defs/osPlatform" },
        "specs": {
          "type": "object",
          "additionalProperties": false,
          "description": "Optional best-effort hardware facts for device-aware recommendations. No identifiers/serials/fingerprints.",
          "properties": {
            "cpu": { "type": "string" },
            "logicalCores": { "type": "integer", "minimum": 0 },
            "totalMemoryBytes": { "type": "integer", "minimum": 0 },
            "gpu": { "type": "string" },
            "osDescription": { "type": "string" },
            "architecture": { "type": "string" }
          }
        }
      }
    },
    "steamAccounts": {
      "type": "array",
      "items": {
        "type": "object",
        "additionalProperties": false,
        "required": ["steamId64", "mostRecent"],
        "properties": {
          "steamId64": { "type": "string" },
          "accountName": { "type": "string" },
          "personaName": { "type": "string" },
          "mostRecent": { "type": "boolean" }
        }
      }
    },
    "libraries": {
      "type": "array",
      "items": {
        "type": "object",
        "additionalProperties": false,
        "required": ["index", "label", "gameCount"],
        "properties": {
          "index": { "type": "integer" },
          "label": { "type": "string", "description": "Library label; full filesystem path is deliberately omitted." },
          "gameCount": { "type": "integer", "minimum": 0 },
          "storage": {
            "type": "object",
            "additionalProperties": false,
            "description": "Optional storage-medium facts for this library (additive, >= 0.5.0). Kind + sizes only; the filesystem path is never included.",
            "required": ["kind"],
            "properties": {
              "kind": { "$ref": "#/$defs/storageKind" },
              "freeBytes": { "type": "integer", "minimum": 0, "description": "Free space in bytes on the backing filesystem (best-effort; absent when unavailable)." },
              "totalBytes": { "type": "integer", "minimum": 0, "description": "Total capacity in bytes of the backing filesystem (best-effort; absent when unavailable)." }
            }
          }
        }
      }
    },
    "games": {
      "type": "array",
      "items": {
        "type": "object",
        "additionalProperties": false,
        "required": ["appId", "name", "installed"],
        "properties": {
          "appId": { "type": "integer" },
          "name": { "type": "string" },
          "installed": { "type": "boolean" },
          "libraryIndex": { "type": "integer", "description": "Local library index; absent when the game is owned but not installed." },
          "installDir": { "type": "string", "description": "Relative folder under steamapps/common (not a full path)." },
          "sizeOnDiskBytes": { "type": "integer", "minimum": 0 },
          "playtimeMinutes": { "type": "integer", "minimum": 0, "description": "Total playtime in minutes (Steam Web API enrichment); absent if not enriched." },
          "lastUpdated": { "type": "string", "format": "date-time" },
          "lastPlayed": { "type": "string", "format": "date-time" },
          "categories": {
            "type": "array",
            "items": { "type": "string" },
            "description": "Local Steam collection/category names the user assigned to this game, in Steam's tag order."
          }
        }
      }
    },
    "categories": {
      "type": "array",
      "description": "The user's local Steam collections/categories with game counts.",
      "items": {
        "type": "object",
        "additionalProperties": false,
        "required": ["name", "gameCount"],
        "properties": {
          "name": { "type": "string" },
          "gameCount": { "type": "integer", "minimum": 0, "description": "Number of categorized (owned) games with this category." }
        }
      }
    },
    "stats": {
      "type": "object",
      "additionalProperties": false,
      "required": ["libraryCount", "installedGameCount", "totalSizeOnDiskBytes"],
      "properties": {
        "libraryCount": { "type": "integer", "minimum": 0 },
        "installedGameCount": { "type": "integer", "minimum": 0 },
        "totalSizeOnDiskBytes": { "type": "integer", "minimum": 0 },
        "scope": { "$ref": "#/$defs/libraryScope" }
      }
    }
  },
  "$defs": {
    "osPlatform": { "type": "string", "enum": ["unknown", "windows", "linux", "macOs"] },
    "deviceType": { "type": "string", "enum": ["unknown", "desktop", "laptop", "steamDeck", "server"] },
    "storageKind": {
      "type": "string",
      "enum": ["internal", "sdCard", "external", "network", "unknown"],
      "description": "Storage-medium kind for a library. 'unknown' when the OS can't determine it (e.g. SD-vs-USB on a desktop card reader, an unknown bus) — producers emit 'unknown' rather than guess."
    },
    "libraryScope": {
      "type": "string",
      "enum": ["installedOnly", "observedSubset", "fullLibrary"],
      "description": "Coverage of the game observations. installedOnly is local installed presence; observedSubset adds positive non-complete observations whose absences prove nothing; fullLibrary is reserved for a source with an explicit completeness contract. Absent defaults to installedOnly."
    }
  }
}
