{"schemaVersion":"0.6.0","snapshotId":"33333333-3333-3333-3333-333333333333","createdAt":"2026-07-22T01:02:03+00:00","source":{"tool":"fixture","toolVersion":"1.0.0","platform":"windows"},"device":{"id":"44444444-4444-4444-4444-444444444444","name":"Fixture device","type":"desktop","os":"windows"},"libraries":[{"index":0,"label":"Primary","gameCount":1},{"index":1,"label":"Secondary","gameCount":1}],"games":[{"appId":10,"name":"Retained Alpha","installed":true,"libraryIndex":0,"sizeOnDiskBytes":100,"categories":["Alpha","Shared"]},{"appId":30,"name":"Retained Gamma","installed":true,"libraryIndex":1,"sizeOnDiskBytes":300,"categories":["Alpha"]},{"appId":40,"name":"Override Delta","installed":false,"playtimeMinutes":10,"categories":["Beta"]}],"categories":[{"name":"Alpha","gameCount":2},{"name":"Beta","gameCount":1},{"name":"Shared","gameCount":1}],"stats":{"libraryCount":2,"installedGameCount":2,"totalSizeOnDiskBytes":400,"scope":"observedSubset"}}
