{"schemaVersion":"0.6.0","snapshotId":"55555555-5555-5555-5555-555555555555","createdAt":"2026-07-22T02:03:04+00:00","source":{"tool":"fixture","toolVersion":"1.0.0","platform":"windows"},"device":{"id":"66666666-6666-6666-6666-666666666666","name":"Fixture device","type":"desktop","os":"windows"},"steamAccounts":[{"steamId64":"76561197960265738","accountName":"synthetic-account","personaName":"Synthetic Persona","mostRecent":true}],"libraries":[{"index":0,"label":"Primary","gameCount":3}],"games":[{"appId":10,"name":"Retained supplementary","installed":true,"libraryIndex":0,"sizeOnDiskBytes":100,"categories":["Order-\uD800\uDC00-supplementary"]},{"appId":20,"name":"Retained replacement","installed":true,"libraryIndex":0,"sizeOnDiskBytes":200,"categories":["Order-\uFFFD-replacement"]},{"appId":30,"name":"Skipped category","installed":true,"libraryIndex":0,"sizeOnDiskBytes":300,"categories":["Removed"]}],"categories":[{"name":"Order-\uFFFD-replacement","gameCount":1},{"name":"Order-\uD800\uDC00-supplementary","gameCount":1},{"name":"Removed","gameCount":1}],"stats":{"libraryCount":1,"installedGameCount":3,"totalSizeOnDiskBytes":600,"scope":"fullLibrary"}}
