{"schemaVersion":"0.6.0","snapshotId":"55555555-5555-5555-5555-555555555555","createdAt":"2026-07-22T02:03:04+00:00","source":{"tool":"fixture","toolVersion":"1.0.0","platform":"windows"},"device":{"id":"66666666-6666-6666-6666-666666666666","name":"Fixture device","type":"desktop","os":"windows"},"libraries":[{"index":0,"label":"Primary","gameCount":2}],"games":[{"appId":10,"name":"Retained supplementary","installed":true,"libraryIndex":0,"sizeOnDiskBytes":100,"categories":["Order-\uD800\uDC00-supplementary"]},{"appId":20,"name":"Retained replacement","installed":true,"libraryIndex":0,"sizeOnDiskBytes":200,"categories":["Order-�-replacement"]}],"categories":[{"name":"Order-\uD800\uDC00-supplementary","gameCount":1},{"name":"Order-�-replacement","gameCount":1}],"stats":{"libraryCount":1,"installedGameCount":2,"totalSizeOnDiskBytes":300,"scope":"observedSubset"}}
