{"schemaVersion":"0.5.0","snapshotId":"11111111-1111-1111-1111-111111111111","createdAt":"2026-07-11T12:34:56+00:00","source":{"tool":"contract-test","toolVersion":"1.2.3","platform":"windows"},"device":{"id":"22222222-2222-2222-2222-222222222222","name":"Living room PC","type":"desktop","os":"windows","specs":{"cpu":"Synthetic CPU","logicalCores":8,"totalMemoryBytes":16000000000,"gpu":"Synthetic GPU","osDescription":"Windows 10/11","architecture":"X64"}},"libraries":[{"index":0,"label":"Main library","gameCount":1,"storage":{"kind":"internal","freeBytes":123456789,"totalBytes":987654321}}],"games":[{"appId":42,"name":"Private shortcut title","installed":true,"libraryIndex":0,"installDir":"Relative Folder","sizeOnDiskBytes":12345,"playtimeMinutes":67,"lastUpdated":"2026-07-10T10:00:00+00:00","lastPlayed":"2026-07-11T11:00:00+00:00","categories":["Deck","Private collection"]}],"categories":[{"name":"Deck","gameCount":1},{"name":"Private collection","gameCount":1}],"stats":{"libraryCount":1,"installedGameCount":1,"totalSizeOnDiskBytes":12345,"scope":"fullLibrary"}}
