{"schemaVersion":"0.6.0","snapshotId":"33333333-3333-3333-3333-333333333333","createdAt":"2026-07-22T01:02:03+00:00","source":{"tool":"fixture","toolVersion":"1.0.0","platform":"windows"},"device":{"id":"44444444-4444-4444-4444-444444444444","name":"Fixture device","type":"desktop","os":"windows"},"libraries":[{"index":0,"label":"Primary","gameCount":0},{"index":1,"label":"Secondary","gameCount":0}],"games":[],"categories":[],"stats":{"libraryCount":2,"installedGameCount":0,"totalSizeOnDiskBytes":0,"scope":"observedSubset"}}
